{
  "schema_version": "agent-loop.assignment.v1",
  "assignment_id": "studio/979/1",
  "issue": "TomasBack2Future/voice-agent-studio#979",
  "item": "STUDIO-083",
  "reservation": {
    "key": "DISPATCH-STUDIO-979",
    "generation": 1
  },
  "repository": "TomasBack2Future/voice-agent-studio",
  "worktree": "/workspace/.worktrees/issue-979-report-intake",
  "branch": "codex/issue-979-report-intake",
  "base_sha": "a33ade6b757c46002b85fd11cf8f3b709f195e14",
  "role": {
    "id": "worker",
    "skill": "agent-loop-worker",
    "version": 1
  },
  "project_profile": {
    "id": "studio",
    "version": 1,
    "path": "workspace/agent-loop/projects/studio/profile.json"
  },
  "authorization": {
    "source_mutation": true,
    "pull_request": true,
    "merge": true,
    "staging": true,
    "production": false,
    "issue_close": true
  },
  "evidence_required": ["test", "review", "manual"]
}

